{
  "format": "sutl-conformance-1.0",
  "dialect": "sUTL",
  "description": "Normative executable definition of sUTL 1.0. Every case is required for conformance.",
  "case_schema": {
    "id": "stable case name",
    "status": "normative | provisional | disputed",
    "evidence": "short provenance note",
    "source": "MAS source value",
    "transform": "sUTL transform",
    "library": "optional transform map",
    "expected": "expected MAS result from the working runner",
    "historical": "optional implementation-specific observations"
  },
  "cases": [
    {
      "id": "literal-number",
      "status": "normative",
      "evidence": "spec grammar; all implementations",
      "source": null,
      "transform": 4.2,
      "expected": 4.2
    },
    {
      "id": "structural-map",
      "status": "normative",
      "evidence": "spec evaluate; Studio examples",
      "source": {
        "name": "Ada"
      },
      "transform": {
        "person": "^$.name",
        "active": true
      },
      "expected": {
        "person": "Ada",
        "active": true
      }
    },
    {
      "id": "structural-list",
      "status": "normative",
      "evidence": "spec evaluate; all implementations",
      "source": {
        "value": 2
      },
      "transform": [
        1,
        "^$.value",
        3
      ],
      "expected": [
        1,
        2,
        3
      ]
    },
    {
      "id": "path-root-head",
      "status": "normative",
      "evidence": "Python tests 15; paths page",
      "source": {
        "name": "Ada"
      },
      "transform": "^$",
      "expected": {
        "name": "Ada"
      }
    },
    {
      "id": "path-map-member",
      "status": "normative",
      "evidence": "Python tests; recovered path-basic example",
      "source": {
        "person": {
          "name": "Ada"
        }
      },
      "transform": "^$.person.name",
      "expected": "Ada"
    },
    {
      "id": "path-list-index",
      "status": "normative",
      "evidence": "Python tests 2; deployed compact path syntax",
      "source": {
        "items": [
          "a",
          "b"
        ]
      },
      "transform": "^$.items.1",
      "expected": "b"
    },
    {
      "id": "path-missing-head",
      "status": "normative",
      "evidence": "Python tests 2 and 21; paths page",
      "source": {},
      "transform": "^$.missing",
      "expected": null
    },
    {
      "id": "path-wildcard",
      "status": "normative",
      "evidence": "recovered paths examples",
      "source": {
        "people": [
          {
            "name": "Ada"
          },
          {
            "name": "Grace"
          }
        ]
      },
      "transform": "&$.people.*.name",
      "expected": [
        "Ada",
        "Grace"
      ]
    },
    {
      "id": "path-recursive-wildcard",
      "status": "normative",
      "evidence": "Python test 19; recovered paths examples",
      "source": {
        "x": [
          {
            "y": "001"
          },
          {
            "y": "002"
          },
          {
            "y": "003"
          }
        ]
      },
      "transform": "&$.x.**.y",
      "expected": [
        "001",
        "002",
        "003"
      ]
    },
    {
      "id": "raw-path",
      "status": "normative",
      "evidence": "Python test 23; rawpathing Studio example",
      "source": null,
      "transform": [
        "^%",
        {
          "x": 1,
          "y": 2
        },
        "y"
      ],
      "expected": 2
    },
    {
      "id": "evaluate-local-scope",
      "status": "normative",
      "evidence": "evaluate-transforms page; Python evaluator",
      "source": null,
      "transform": {
        "!": {
          "'": "^@.value"
        },
        "value": 7
      },
      "expected": 7
    },
    {
      "id": "evaluate2-scope-delta",
      "status": "normative",
      "evidence": "rescued alternate Evaluate Transform documentation and handwritten JavaScript; Studio/HaxeJS contains a scope-merge defect",
      "source": null,
      "transform": {
        "!!": {
          ":": {
            "result": "^@.value"
          }
        },
        "s": {
          "value": 7
        }
      },
      "expected": {
        "result": 7
      },
      "historical": {
        "python2": "unsupported",
        "handwritten_js": {
          "result": 7
        },
        "studio_haxe_js": {
          "result": null
        }
      }
    },
    {
      "id": "library-path-and-call",
      "status": "normative",
      "evidence": "libraries page; Python and Studio evaluators",
      "source": null,
      "library": {
        "addone": [
          "&+",
          "^@.value",
          1
        ]
      },
      "transform": {
        "!": "^*.addone",
        "value": 4
      },
      "expected": 5
    },
    {
      "id": "quote-and-double-quote",
      "status": "normative",
      "evidence": "Python test 12; transforms page",
      "source": {
        "updated": 42
      },
      "transform": {
        "'": {
          "a": "^$.updated",
          "b": {
            "''": "^$.updated"
          }
        }
      },
      "expected": {
        "a": "^$.updated",
        "b": 42
      }
    },
    {
      "id": "colon-literal",
      "status": "normative",
      "evidence": "website transform reference; all later implementations",
      "source": {
        "x": 1
      },
      "transform": {
        ":": "^$.x"
      },
      "expected": "^$.x"
    },
    {
      "id": "flatten-list",
      "status": "normative",
      "evidence": "spec evaluate; concatenate Studio example",
      "source": null,
      "transform": [
        "&&",
        [
          1,
          2
        ],
        3,
        [
          4,
          5
        ]
      ],
      "expected": [
        1,
        2,
        3,
        4,
        5
      ]
    },
    {
      "id": "compact-add-reduction",
      "status": "normative",
      "evidence": "structured-builtins page; Python implementation",
      "source": null,
      "transform": [
        "&+",
        1,
        2,
        3
      ],
      "expected": 6
    },
    {
      "id": "string-concatenation",
      "status": "normative",
      "evidence": "structured-builtins reference and all implementations",
      "source": null,
      "transform": [
        "&+",
        "first",
        "second"
      ],
      "expected": "firstsecond"
    },
    {
      "id": "mixed-addition-fails",
      "status": "normative",
      "evidence": "structured-builtins reference and core equality tests",
      "source": null,
      "transform": [
        "&+",
        "1",
        1
      ],
      "expected": null
    },
    {
      "id": "null-add-default",
      "status": "normative",
      "evidence": "Python test 24; production behavior",
      "source": null,
      "transform": [
        "&+",
        null,
        3
      ],
      "expected": 3
    },
    {
      "id": "strict-bool-number-equality",
      "status": "normative",
      "evidence": "Python 2017 equality fix; Haxe tests; website prose",
      "source": null,
      "transform": [
        "&=",
        false,
        0
      ],
      "expected": false
    },
    {
      "id": "unicode-string-equality",
      "status": "normative",
      "evidence": "Python test 20 and unicode fix",
      "source": null,
      "transform": [
        "&=",
        "thing",
        "thing"
      ],
      "expected": true
    },
    {
      "id": "comparison-rejects-nonnumbers",
      "status": "normative",
      "evidence": "structured-builtins reference requires numeric operands and specifies false otherwise",
      "source": null,
      "transform": [
        "&<",
        "2",
        10
      ],
      "expected": false
    },
    {
      "id": "if-falsey-empty-list",
      "status": "normative",
      "evidence": "Python test 8; website truthiness definition",
      "source": null,
      "transform": {
        "&": "if",
        "cond": [],
        "true": 1,
        "false": 0
      },
      "expected": 0
    },
    {
      "id": "reduce-sum",
      "status": "normative",
      "evidence": "Python reducer and tests; website reduce documentation",
      "source": null,
      "transform": {
        "&": "reduce",
        "list": [
          1,
          2,
          3,
          4
        ],
        "accum": 0,
        "t": {
          "'": [
            "&+",
            "^@.accum",
            "^@.item"
          ]
        }
      },
      "expected": 10
    },
    {
      "id": "sorted-keys",
      "status": "normative",
      "evidence": "Python 1.0.5b4 change and test 11",
      "source": null,
      "transform": {
        "&": "keys",
        "map": {
          "z": 1,
          "a": 2
        }
      },
      "expected": [
        "a",
        "z"
      ]
    },
    {
      "id": "sorted-values",
      "status": "normative",
      "evidence": "Python 1.0.5b4 change; keys and values share ordering",
      "source": null,
      "transform": {
        "&": "values",
        "map": {
          "z": 1,
          "a": 2
        }
      },
      "expected": [
        2,
        1
      ]
    },
    {
      "id": "type-separation",
      "status": "normative",
      "evidence": "spec, website, Python builtins",
      "source": null,
      "transform": [
        {
          "&": "type",
          "value": {}
        },
        {
          "&": "type",
          "value": []
        },
        {
          "&": "type",
          "value": "x"
        },
        {
          "&": "type",
          "value": 1
        },
        {
          "&": "type",
          "value": true
        },
        {
          "&": "type",
          "value": null
        }
      ],
      "expected": [
        "map",
        "list",
        "string",
        "number",
        "boolean",
        "null"
      ]
    },
    {
      "id": "makemap-skips-invalid-pairs",
      "status": "normative",
      "evidence": "spec and Python builtin",
      "source": null,